{
  "$schema": "https://json-schema.org/draft/2020-12/schema",
  "title": "BRP Reference Table File",
  "description": "Schema for Basic Roleplaying reference-table JSON files. Each file groups one or more related lookup tables (skills, professions, or equipment stats) from the SRD, rather than random-generator tables.",
  "type": "object",
  "required": ["name", "game", "licence", "attribution", "tables"],
  "properties": {
    "name": { "type": "string", "example": "BRP: Skills" },
    "game": { "type": "string", "const": "brp" },
    "licence": { "type": "string", "const": "BRP Open Game License, Version 1.0" },
    "attribution": { "type": "string" },
    "usage_note": { "type": "string", "description": "File-level note on how the table's chances or fields are used." },
    "tables": {
      "type": "array",
      "minItems": 1,
      "items": {
        "type": "object",
        "required": ["id", "name", "roll", "entries"],
        "properties": {
          "id": { "type": "string", "description": "URL-safe identifier" },
          "name": { "type": "string", "description": "Display name for this table" },
          "roll": { "type": "string", "description": "The mechanic used with this table, e.g. 'D100 (roll ≤ chance to succeed)', or 'Reference (no roll)'" },
          "usage_note": { "type": "string", "description": "Optional note on how or when to use this table" },
          "entries": {
            "type": "array",
            "minItems": 1,
            "description": "An array of objects, one per skill/profession/weapon/armor/shield entry. Field names vary by table (see individual files) since these are reference tables rather than flat roll results.",
            "items": { "type": "object" }
          }
        }
      }
    }
  }
}
